{
  "schema_version": "mindclade.dev/release-evidence/v1",
  "release_id": "v1.0.0-contract-fixture",
  "release_kind": "application",
  "subject": {
    "name": "platform-contract-fixture",
    "digest": "sha256:aaaaaaaaaaaaaaaaaaaaaaaaaaaaaaaaaaaaaaaaaaaaaaaaaaaaaaaaaaaaaaaa"
  },
  "source_repository": "mindclade/mindclade-internal-monorepo",
  "source_revision": "bbbbbbbbbbbbbbbbbbbbbbbbbbbbbbbbbbbbbbbb",
  "builder_identity": "projects/mc-build-security/serviceAccounts/arc-builder",
  "build_invocation_id": "fixture-build-1",
  "images": {
    "runtime": "us-central1-docker.pkg.dev/mc-common-ci/releases/contract-fixture@sha256:aaaaaaaaaaaaaaaaaaaaaaaaaaaaaaaaaaaaaaaaaaaaaaaaaaaaaaaaaaaaaaaa"
  },
  "artifacts": [
    {
      "name": "provenance",
      "type": "provenance",
      "uri": "https://evidence.invalid/provenance.json",
      "digest": "sha256:cccccccccccccccccccccccccccccccccccccccccccccccccccccccccccccccc",
      "media_type": "application/vnd.in-toto+json"
    },
    {
      "name": "qualification",
      "type": "qualification",
      "uri": "https://evidence.invalid/qualification.json",
      "digest": "sha256:dddddddddddddddddddddddddddddddddddddddddddddddddddddddddddddddd",
      "media_type": "application/json"
    },
    {
      "name": "rollback",
      "type": "rollback",
      "uri": "https://evidence.invalid/rollback.json",
      "digest": "sha256:eeeeeeeeeeeeeeeeeeeeeeeeeeeeeeeeeeeeeeeeeeeeeeeeeeeeeeeeeeeeeeee",
      "media_type": "application/json"
    },
    {
      "name": "sbom",
      "type": "sbom",
      "uri": "https://evidence.invalid/sbom.json",
      "digest": "sha256:ffffffffffffffffffffffffffffffffffffffffffffffffffffffffffffffff",
      "media_type": "application/vnd.cyclonedx+json"
    },
    {
      "name": "vulnerability-scan",
      "type": "vulnerability-scan",
      "uri": "https://evidence.invalid/vulnerability.json",
      "digest": "sha256:1111111111111111111111111111111111111111111111111111111111111111",
      "media_type": "application/json"
    }
  ],
  "vulnerability": {
    "result": "pass",
    "scanner": "trivy",
    "scanner_version": "1.2.3",
    "database_digest": "sha256:2222222222222222222222222222222222222222222222222222222222222222",
    "scanned_at": "2026-08-20T00:01:00Z",
    "finding_counts": {"critical": 0, "high": 0, "medium": 0, "low": 0, "unknown": 0},
    "exception": null
  },
  "evidence": {
    "result": "pass",
    "policy": {
      "id": "production-release",
      "version": "1.0.0",
      "digest": "sha256:3333333333333333333333333333333333333333333333333333333333333333"
    },
    "qualification_epoch": "2026-08-20T00:02:00Z",
    "graph": [
      {"subject_digest": "sha256:aaaaaaaaaaaaaaaaaaaaaaaaaaaaaaaaaaaaaaaaaaaaaaaaaaaaaaaaaaaaaaaa", "predicate_type": "build-provenance", "artifact": "provenance", "result": "pass"},
      {"subject_digest": "sha256:aaaaaaaaaaaaaaaaaaaaaaaaaaaaaaaaaaaaaaaaaaaaaaaaaaaaaaaaaaaaaaaa", "predicate_type": "qualification", "artifact": "qualification", "result": "pass"},
      {"subject_digest": "sha256:aaaaaaaaaaaaaaaaaaaaaaaaaaaaaaaaaaaaaaaaaaaaaaaaaaaaaaaaaaaaaaaa", "predicate_type": "sbom", "artifact": "sbom", "result": "pass"},
      {"subject_digest": "sha256:aaaaaaaaaaaaaaaaaaaaaaaaaaaaaaaaaaaaaaaaaaaaaaaaaaaaaaaaaaaaaaaa", "predicate_type": "vulnerability-scan", "artifact": "vulnerability-scan", "result": "pass"}
    ]
  },
  "attestations": {
    "build": {"project": "mc-build-security", "attestor": "build-attestor"},
    "qualification": {"project": "mc-qualification-security", "attestor": "qualification-attestor"}
  },
  "compatibility": {
    "kubernetes": ">=1.36.0 <1.37.0",
    "platform_api": "1.0.0",
    "required_capabilities": ["workload-identity"]
  },
  "migration": {"required": false, "artifact": null},
  "rollback": {
    "strategy": "previous-release",
    "previous_release_id": "v0.9.0-contract-fixture",
    "previous_subject_digest": "sha256:4444444444444444444444444444444444444444444444444444444444444444",
    "artifact": "rollback"
  },
  "created_at": "2026-08-20T00:03:00Z"
}
